<!ELEMENT menu (meals, beverages)>
<!ELEMENT meals (meal+)>
<!ELEMENT meal (name, price, description, image)>
<!ELEMENT beverages (beverage+)>
<!ELEMENT beverage (name, price, description, image)>
<!ELEMENT name (#PCDATA)>
<!ELEMENT price (#PCDATA)>
<!ELEMENT description (#PCDATA)>
<!ELEMENT image (#PCDATA)>